{
  "$schema": "./products.schema.json",
  "team": "Lurexa1",
  "repository": "damianalbertocastro-bot/Lurexa-ecosystem",
  "productionBranch": "main",
  "principles": {
    "oneVercelProjectPerDeployableSurface": true,
    "affectedWorkspaceBuildsOnly": true,
    "sharedLayersAreNotStandaloneWebProjects": true,
    "mobileIsNotHostedOnVercel": true
  },
  "deployments": [
    {
      "id": "ecosystem-web",
      "product": "Lurexa Learning Technologies",
      "surface": "ecosystem",
      "workspace": "web",
      "rootDirectory": "apps/web",
      "vercelProject": "lurexa",
      "status": "provisioned"
    },
    {
      "id": "learn-web",
      "product": "Lurexa Learn",
      "surface": "learner-web",
      "workspace": "learn-web",
      "rootDirectory": "apps/learn-web",
      "vercelProject": "lurexa-learn-web",
      "status": "provisioned"
    },
    {
      "id": "learn-teacher",
      "product": "Lurexa Learn",
      "surface": "teacher-workspace",
      "workspace": "learn-web",
      "rootDirectory": "apps/learn-web",
      "vercelProject": "lurexa-learn-web",
      "status": "shared-deployment"
    },
    {
      "id": "coach-web",
      "product": "Lurexa Coach",
      "surface": "adaptive-speaking-web",
      "workspace": "@lurexa/coach-web",
      "rootDirectory": "apps/coach-web",
      "vercelProject": "coach-web",
      "status": "provisioned"
    },
    {
      "id": "teach-web",
      "product": "Lurexa Teach",
      "surface": "professional-development-web",
      "workspace": "@lurexa/teach-web",
      "rootDirectory": "apps/teach-web",
      "vercelProject": "lurexa-teach-web",
      "status": "provisioned"
    },
    {
      "id": "admin-web",
      "product": "Lurexa Admin",
      "surface": "operations-web",
      "workspace": "admin-portal",
      "rootDirectory": "apps/admin-portal",
      "vercelProject": "lurexa-admin",
      "status": "provisioned"
    },
    {
      "id": "docs-web",
      "product": "Lurexa Docs",
      "surface": "documentation",
      "workspace": "docs",
      "rootDirectory": "apps/docs",
      "vercelProject": "docs",
      "status": "provisioned"
    },
    {
      "id": "studio-web",
      "product": "Lurexa Studio",
      "surface": "authoring-studio-web",
      "workspace": "@lurexa/studio-web",
      "rootDirectory": "apps/studio-web",
      "vercelProject": "lurexa-studio-web",
      "status": "provisioned"
    },
    {
      "id": "insight-web",
      "product": "Lurexa Insight",
      "surface": "analytics-insight-web",
      "workspace": "@lurexa/insight-web",
      "rootDirectory": "apps/insight-web",
      "vercelProject": "lurexa-insight-web",
      "status": "provisioned"
    },
    {
      "id": "mobile",
      "product": "Lurexa Learn",
      "surface": "mobile",
      "workspace": "mobile",
      "rootDirectory": "apps/mobile",
      "vercelProject": null,
      "status": "non-vercel"
    }
  ],
  "futureProducts": [
    {
      "product": "Lurexa Campus",
      "expectedVercelProject": "lurexa-campus-web",
      "createWhen": "apps/campus-web exists"
    }
  ],
  "sharedLayers": [
    {
      "name": "Lurexa Core",
      "deploymentRule": "shared backend/platform packages and trusted services; not an end-user website project"
    },
    {
      "name": "Lurexa Mind",
      "deploymentRule": "shared intelligence layer; not an end-user website project unless a dedicated service is introduced later"
    }
  ]
}
